{
  "semantic_id": "feature_id:architecture.agent_collab_protocol",
  "run_id": "20260712T080000Z-routecodex-12345-a1b2",
  "worker_id": null,
  "task_id": "agent-collab-protocol",
  "status": "active",
  "created_at": "2026-07-12T08:00:01Z",
  "updated_at": "2026-07-12T08:00:01Z",
  "ttl_seconds": 600,
  "allowed_paths": [
    ".agent-collab/PROTOCOL.md",
    ".agent-collab/schema",
    ".agent-collab/examples",
    "scripts/architecture/verify-agent-collab-protocol.mjs",
    "scripts/tests/agent-collab-protocol-red-fixtures.mjs"
  ],
  "required_gates": [
    "npm run verify:agent-collab-protocol",
    "npm run test:agent-collab-protocol-red-fixtures"
  ]
}
